[
  {
    "eventId": "c41d34cf1ec4380f1d64ca963ec8ddc900687fb2792abc72166db0f46bfa84ad",
    "eventType": "MarketCurve",
    "schemaVersion": 1,
    "source": "hallmark-ingest",
    "key": "GSEC_PAR:2026-10-14",
    "businessDate": "2026-10-14",
    "producedAt": "2026-10-15T14:02:43.767339+00:00",
    "payload": {
      "asOfDate": "2026-10-14",
      "source": "FBIL",
      "curveType": "GSEC_PAR",
      "compounding": "SEMI_ANNUAL",
      "points": [
        {
          "tenorYears": 0.25,
          "parYield": 5.66
        },
        {
          "tenorYears": 0.5,
          "parYield": 6.2
        },
        {
          "tenorYears": 0.75,
          "parYield": 6.42
        },
        {
          "tenorYears": 1.0,
          "parYield": 6.47
        },
        {
          "tenorYears": 1.25,
          "parYield": 6.48
        },
        {
          "tenorYears": 1.5,
          "parYield": 6.55
        },
        {
          "tenorYears": 1.75,
          "parYield": 6.61
        },
        {
          "tenorYears": 2.0,
          "parYield": 6.69
        },
        {
          "tenorYears": 2.25,
          "parYield": 6.76
        },
        {
          "tenorYears": 2.5,
          "parYield": 6.83
        },
        {
          "tenorYears": 2.75,
          "parYield": 6.89
        },
        {
          "tenorYears": 3.0,
          "parYield": 6.94
        },
        {
          "tenorYears": 3.25,
          "parYield": 6.97
        },
        {
          "tenorYears": 3.5,
          "parYield": 7.0
        },
        {
          "tenorYears": 3.75,
          "parYield": 7.03
        },
        {
          "tenorYears": 4.0,
          "parYield": 7.07
        },
        {
          "tenorYears": 4.25,
          "parYield": 7.11
        },
        {
          "tenorYears": 4.5,
          "parYield": 7.17
        },
        {
          "tenorYears": 4.75,
          "parYield": 7.21
        },
        {
          "tenorYears": 5.0,
          "parYield": 7.22
        },
        {
          "tenorYears": 5.25,
          "parYield": 7.22
        },
        {
          "tenorYears": 5.5,
          "parYield": 7.23
        },
        {
          "tenorYears": 5.75,
          "parYield": 7.25
        },
        {
          "tenorYears": 6.0,
          "parYield": 7.27
        },
        {
          "tenorYears": 6.25,
          "parYield": 7.28
        },
        {
          "tenorYears": 6.5,
          "parYield": 7.28
        },
        {
          "tenorYears": 6.75,
          "parYield": 7.29
        },
        {
          "tenorYears": 7.0,
          "parYield": 7.3
        },
        {
          "tenorYears": 7.25,
          "parYield": 7.31
        },
        {
          "tenorYears": 7.5,
          "parYield": 7.32
        },
        {
          "tenorYears": 7.75,
          "parYield": 7.31
        },
        {
          "tenorYears": 8.0,
          "parYield": 7.31
        },
        {
          "tenorYears": 8.25,
          "parYield": 7.3
        },
        {
          "tenorYears": 8.5,
          "parYield": 7.3
        },
        {
          "tenorYears": 8.75,
          "parYield": 7.32
        },
        {
          "tenorYears": 9.0,
          "parYield": 7.35
        },
        {
          "tenorYears": 9.25,
          "parYield": 7.37
        },
        {
          "tenorYears": 9.5,
          "parYield": 7.39
        },
        {
          "tenorYears": 9.75,
          "parYield": 7.4
        },
        {
          "tenorYears": 10.0,
          "parYield": 7.41
        },
        {
          "tenorYears": 10.25,
          "parYield": 7.42
        },
        {
          "tenorYears": 10.5,
          "parYield": 7.43
        },
        {
          "tenorYears": 10.75,
          "parYield": 7.43
        },
        {
          "tenorYears": 11.0,
          "parYield": 7.43
        },
        {
          "tenorYears": 11.25,
          "parYield": 7.43
        },
        {
          "tenorYears": 11.5,
          "parYield": 7.43
        },
        {
          "tenorYears": 11.75,
          "parYield": 7.43
        },
        {
          "tenorYears": 12.0,
          "parYield": 7.43
        },
        {
          "tenorYears": 12.25,
          "parYield": 7.42
        },
        {
          "tenorYears": 12.5,
          "parYield": 7.43
        },
        {
          "tenorYears": 12.75,
          "parYield": 7.43
        },
        {
          "tenorYears": 13.0,
          "parYield": 7.43
        },
        {
          "tenorYears": 13.25,
          "parYield": 7.43
        },
        {
          "tenorYears": 13.5,
          "parYield": 7.44
        },
        {
          "tenorYears": 13.75,
          "parYield": 7.45
        },
        {
          "tenorYears": 14.0,
          "parYield": 7.46
        },
        {
          "tenorYears": 14.25,
          "parYield": 7.47
        },
        {
          "tenorYears": 14.5,
          "parYield": 7.49
        },
        {
          "tenorYears": 14.75,
          "parYield": 7.5
        },
        {
          "tenorYears": 15.0,
          "parYield": 7.52
        },
        {
          "tenorYears": 15.25,
          "parYield": 7.53
        },
        {
          "tenorYears": 15.5,
          "parYield": 7.55
        },
        {
          "tenorYears": 15.75,
          "parYield": 7.56
        },
        {
          "tenorYears": 16.0,
          "parYield": 7.57
        },
        {
          "tenorYears": 16.25,
          "parYield": 7.58
        },
        {
          "tenorYears": 16.5,
          "parYield": 7.59
        },
        {
          "tenorYears": 16.75,
          "parYield": 7.6
        },
        {
          "tenorYears": 17.0,
          "parYield": 7.61
        },
        {
          "tenorYears": 17.25,
          "parYield": 7.62
        },
        {
          "tenorYears": 17.5,
          "parYield": 7.63
        },
        {
          "tenorYears": 17.75,
          "parYield": 7.64
        },
        {
          "tenorYears": 18.0,
          "parYield": 7.65
        },
        {
          "tenorYears": 18.25,
          "parYield": 7.65
        },
        {
          "tenorYears": 18.5,
          "parYield": 7.66
        },
        {
          "tenorYears": 18.75,
          "parYield": 7.67
        },
        {
          "tenorYears": 19.0,
          "parYield": 7.67
        },
        {
          "tenorYears": 19.25,
          "parYield": 7.68
        },
        {
          "tenorYears": 19.5,
          "parYield": 7.69
        },
        {
          "tenorYears": 19.75,
          "parYield": 7.69
        },
        {
          "tenorYears": 20.0,
          "parYield": 7.7
        },
        {
          "tenorYears": 20.25,
          "parYield": 7.7
        },
        {
          "tenorYears": 20.5,
          "parYield": 7.71
        },
        {
          "tenorYears": 20.75,
          "parYield": 7.72
        },
        {
          "tenorYears": 21.0,
          "parYield": 7.72
        },
        {
          "tenorYears": 21.25,
          "parYield": 7.73
        },
        {
          "tenorYears": 21.5,
          "parYield": 7.73
        },
        {
          "tenorYears": 21.75,
          "parYield": 7.74
        },
        {
          "tenorYears": 22.0,
          "parYield": 7.74
        },
        {
          "tenorYears": 22.25,
          "parYield": 7.75
        },
        {
          "tenorYears": 22.5,
          "parYield": 7.75
        },
        {
          "tenorYears": 22.75,
          "parYield": 7.76
        },
        {
          "tenorYears": 23.0,
          "parYield": 7.76
        },
        {
          "tenorYears": 23.25,
          "parYield": 7.77
        },
        {
          "tenorYears": 23.5,
          "parYield": 7.77
        },
        {
          "tenorYears": 23.75,
          "parYield": 7.77
        },
        {
          "tenorYears": 24.0,
          "parYield": 7.78
        },
        {
          "tenorYears": 24.25,
          "parYield": 7.78
        },
        {
          "tenorYears": 24.5,
          "parYield": 7.79
        },
        {
          "tenorYears": 24.75,
          "parYield": 7.79
        },
        {
          "tenorYears": 25.0,
          "parYield": 7.8
        },
        {
          "tenorYears": 25.25,
          "parYield": 7.8
        },
        {
          "tenorYears": 25.5,
          "parYield": 7.81
        },
        {
          "tenorYears": 25.75,
          "parYield": 7.81
        },
        {
          "tenorYears": 26.0,
          "parYield": 7.81
        },
        {
          "tenorYears": 26.25,
          "parYield": 7.82
        },
        {
          "tenorYears": 26.5,
          "parYield": 7.82
        },
        {
          "tenorYears": 26.75,
          "parYield": 7.82
        },
        {
          "tenorYears": 27.0,
          "parYield": 7.83
        },
        {
          "tenorYears": 27.25,
          "parYield": 7.83
        },
        {
          "tenorYears": 27.5,
          "parYield": 7.83
        },
        {
          "tenorYears": 27.75,
          "parYield": 7.83
        },
        {
          "tenorYears": 28.0,
          "parYield": 7.83
        },
        {
          "tenorYears": 28.25,
          "parYield": 7.83
        },
        {
          "tenorYears": 28.5,
          "parYield": 7.83
        },
        {
          "tenorYears": 28.75,
          "parYield": 7.83
        },
        {
          "tenorYears": 29.0,
          "parYield": 7.83
        },
        {
          "tenorYears": 29.25,
          "parYield": 7.83
        },
        {
          "tenorYears": 29.5,
          "parYield": 7.83
        },
        {
          "tenorYears": 29.75,
          "parYield": 7.83
        },
        {
          "tenorYears": 30.0,
          "parYield": 7.83
        },
        {
          "tenorYears": 30.25,
          "parYield": 7.83
        },
        {
          "tenorYears": 30.5,
          "parYield": 7.83
        },
        {